{
  "pass": "security",
  "category": "security",
  "expert": "security-auditor",
  "summary": "No Critical/High security issues; path traversal mitigated by normalize-path usage.",
  "generatedAt": "2026-06-18T10:24:30.000Z",
  "findings": [],
  "deferToLaterPasses": [],
  "openQuestions": ["Should symlink following be configurable for untrusted watch roots?"]
}
